{
  "id": "geography",
  "title": "日本と世界の地理",
  "description": "都道府県・国と首都・大陸・世界のふしぎ",
  "author": "ワイプ・アーケード",
  "version": "1",
  "items": [
    {
      "tags": [
        "日本"
      ],
      "type": "choice",
      "q": "日本でいちばん面積が大きい都道府県は？",
      "choices": [
        "北海道",
        "岩手県",
        "長野県",
        "新潟県"
      ],
      "answer": 0,
      "explain": "2位は岩手県。",
      "short": "面積がいちばん大きい県",
      "level": 1
    },
    {
      "tags": [
        "日本"
      ],
      "type": "choice",
      "q": "日本でいちばん面積が小さい都道府県は？",
      "choices": [
        "香川県",
        "大阪府",
        "東京都",
        "沖縄県"
      ],
      "answer": 0,
      "explain": "「うどん県」とも呼ばれます。",
      "short": "面積がいちばん小さい県",
      "level": 2
    },
    {
      "tags": [
        "日本"
      ],
      "type": "choice",
      "q": "日本でいちばん大きい湖は？",
      "choices": [
        "琵琶湖",
        "霞ヶ浦",
        "猪苗代湖",
        "浜名湖"
      ],
      "answer": 0,
      "explain": "滋賀県の面積の約6分の1をしめます。",
      "short": "日本一大きい湖",
      "level": 1
    },
    {
      "tags": [
        "日本"
      ],
      "type": "choice",
      "q": "都道府県の数は？",
      "choices": [
        "47",
        "43",
        "50",
        "45"
      ],
      "answer": 0,
      "explain": "1都1道2府43県。",
      "short": "都道府県の数",
      "level": 1
    },
    {
      "tags": [
        "日本"
      ],
      "type": "choice",
      "q": "日本の最南端の島は？",
      "choices": [
        "沖ノ鳥島",
        "与那国島",
        "南鳥島",
        "石垣島"
      ],
      "answer": 0,
      "explain": "最東端は南鳥島、最西端は与那国島、最北端は択捉島。",
      "level": 3
    },
    {
      "tags": [
        "日本"
      ],
      "type": "choice",
      "q": "「さくらんぼ」の生産量が日本一の県は？",
      "choices": [
        "山形県",
        "青森県",
        "長野県",
        "山梨県"
      ],
      "answer": 0,
      "explain": "全国の約7割を山形県がつくっています。",
      "short": "さくらんぼ日本一",
      "level": 2
    },
    {
      "tags": [
        "日本"
      ],
      "type": "choice",
      "q": "「みかん」の生産量が多いことで知られる県は？",
      "choices": [
        "和歌山県",
        "北海道",
        "新潟県",
        "岩手県"
      ],
      "answer": 0,
      "explain": "和歌山・愛媛・静岡などが有名。",
      "short": "みかんで有名な県",
      "level": 2
    },
    {
      "tags": [
        "日本"
      ],
      "type": "truefalse",
      "q": "日本は、4つの大きな島とたくさんの小さな島からできている。",
      "answer": true,
      "explain": "北海道・本州・四国・九州の4つ。",
      "level": 1
    },
    {
      "tags": [
        "日本"
      ],
      "type": "truefalse",
      "q": "日本でいちばん長い川は利根川である。",
      "answer": false,
      "explain": "いちばん長いのは信濃川（367km）。利根川は2番目。",
      "level": 2
    },
    {
      "tags": [
        "日本"
      ],
      "type": "truefalse",
      "q": "沖縄県の県庁所在地は那覇市である。",
      "answer": true,
      "explain": "",
      "level": 1
    },
    {
      "tags": [
        "日本"
      ],
      "type": "truefalse",
      "q": "富士山は、静岡県と山梨県にまたがっている。",
      "answer": true,
      "explain": "",
      "level": 1
    },
    {
      "tags": [
        "日本"
      ],
      "type": "pairs",
      "q": "都道府県と県庁所在地（名前がちがうところ）",
      "pairs": [
        [
          "北海道",
          "札幌市"
        ],
        [
          "宮城県",
          "仙台市"
        ],
        [
          "愛知県",
          "名古屋市"
        ],
        [
          "兵庫県",
          "神戸市"
        ],
        [
          "石川県",
          "金沢市"
        ],
        [
          "香川県",
          "高松市"
        ],
        [
          "愛媛県",
          "松山市"
        ],
        [
          "沖縄県",
          "那覇市"
        ]
      ]
    },
    {
      "tags": [
        "日本"
      ],
      "type": "pairs",
      "q": "名物と都道府県",
      "pairs": [
        [
          "讃岐うどん",
          "香川県"
        ],
        [
          "たこ焼き",
          "大阪府"
        ],
        [
          "もみじまんじゅう",
          "広島県"
        ],
        [
          "ずんだもち",
          "宮城県"
        ],
        [
          "八ツ橋",
          "京都府"
        ],
        [
          "ちんすこう",
          "沖縄県"
        ]
      ]
    },
    {
      "tags": [
        "日本"
      ],
      "type": "groups",
      "q": "都道府県と地方",
      "groups": [
        {
          "name": "東北地方",
          "items": [
            "青森県",
            "岩手県",
            "秋田県",
            "山形県"
          ]
        },
        {
          "name": "九州地方",
          "items": [
            "福岡県",
            "熊本県",
            "大分県",
            "宮崎県"
          ]
        },
        {
          "name": "中国地方",
          "items": [
            "岡山県",
            "広島県",
            "鳥取県",
            "島根県"
          ]
        },
        {
          "name": "四国地方",
          "items": [
            "香川県",
            "愛媛県",
            "徳島県",
            "高知県"
          ]
        }
      ]
    },
    {
      "tags": [
        "日本"
      ],
      "type": "groups",
      "q": "海に面している県・面していない県",
      "groups": [
        {
          "name": "海に面していない",
          "items": [
            "栃木県",
            "群馬県",
            "埼玉県",
            "山梨県",
            "長野県",
            "岐阜県",
            "滋賀県",
            "奈良県"
          ]
        },
        {
          "name": "海に面している",
          "items": [
            "千葉県",
            "静岡県",
            "三重県",
            "福井県"
          ]
        }
      ]
    },
    {
      "tags": [
        "日本"
      ],
      "type": "order",
      "q": "日本の4つの大きな島を、面積が大きい順にならべよう",
      "items": [
        "本州",
        "北海道",
        "九州",
        "四国"
      ]
    },
    {
      "tags": [
        "日本"
      ],
      "type": "order",
      "q": "都市を、北にある順にならべよう",
      "items": [
        "札幌",
        "仙台",
        "東京",
        "大阪",
        "福岡",
        "那覇"
      ]
    },
    {
      "tags": [
        "世界"
      ],
      "type": "choice",
      "q": "世界でいちばん面積が大きい国は？",
      "choices": [
        "ロシア",
        "カナダ",
        "アメリカ",
        "中国"
      ],
      "answer": 0,
      "explain": "2位はカナダ。",
      "short": "面積がいちばん大きい国",
      "level": 1
    },
    {
      "tags": [
        "世界"
      ],
      "type": "choice",
      "q": "世界でいちばん面積が小さい国は？",
      "choices": [
        "バチカン市国",
        "モナコ",
        "ナウル",
        "サンマリノ"
      ],
      "answer": 0,
      "explain": "イタリアのローマの中にある国。",
      "short": "いちばん小さい国",
      "level": 2
    },
    {
      "tags": [
        "世界"
      ],
      "type": "choice",
      "q": "世界でいちばん広い海（大洋）は？",
      "choices": [
        "太平洋",
        "大西洋",
        "インド洋",
        "北極海"
      ],
      "answer": 0,
      "explain": "地球の表面の約3分の1をしめます。",
      "short": "いちばん広い海",
      "level": 1
    },
    {
      "tags": [
        "世界"
      ],
      "type": "choice",
      "q": "世界でいちばん大きい砂漠は？（南極などをのぞく）",
      "choices": [
        "サハラ砂漠",
        "ゴビ砂漠",
        "アラビア砂漠",
        "カラハリ砂漠"
      ],
      "answer": 0,
      "explain": "アフリカ大陸の北部に広がっています。",
      "level": 2
    },
    {
      "tags": [
        "世界"
      ],
      "type": "choice",
      "q": "オーストラリアの首都は？",
      "choices": [
        "キャンベラ",
        "シドニー",
        "メルボルン",
        "パース"
      ],
      "answer": 0,
      "explain": "いちばん大きな都市はシドニーですが、首都はキャンベラ。",
      "short": "オーストラリアの首都",
      "level": 2
    },
    {
      "tags": [
        "世界"
      ],
      "type": "choice",
      "q": "カナダの首都は？",
      "choices": [
        "オタワ",
        "トロント",
        "バンクーバー",
        "モントリオール"
      ],
      "answer": 0,
      "explain": "",
      "short": "カナダの首都",
      "level": 3
    },
    {
      "tags": [
        "世界"
      ],
      "type": "choice",
      "q": "ブラジルで主に話されている言葉は？",
      "choices": [
        "ポルトガル語",
        "スペイン語",
        "英語",
        "フランス語"
      ],
      "answer": 0,
      "explain": "南アメリカの多くの国はスペイン語ですが、ブラジルはポルトガル語。",
      "level": 2
    },
    {
      "tags": [
        "世界"
      ],
      "type": "choice",
      "q": "「自由の女神像」がある都市は？",
      "choices": [
        "ニューヨーク",
        "パリ",
        "ロンドン",
        "ワシントン"
      ],
      "answer": 0,
      "explain": "フランスからおくられました。",
      "short": "自由の女神の都市",
      "level": 1
    },
    {
      "tags": [
        "世界"
      ],
      "type": "choice",
      "q": "エッフェル塔がある都市は？",
      "choices": [
        "パリ",
        "ローマ",
        "ロンドン",
        "ベルリン"
      ],
      "answer": 0,
      "explain": "",
      "short": "エッフェル塔の都市",
      "level": 1
    },
    {
      "tags": [
        "世界"
      ],
      "type": "truefalse",
      "q": "赤道は、地球を北半球と南半球に分ける線である。",
      "answer": true,
      "explain": "緯度0度の線。",
      "level": 1
    },
    {
      "tags": [
        "世界"
      ],
      "type": "truefalse",
      "q": "南極では、南極条約によって、国が新しく領土を主張することが禁止されている。",
      "answer": true,
      "explain": "南極は平和のために使い、科学の調査で協力することが決められています。",
      "level": 3
    },
    {
      "tags": [
        "世界"
      ],
      "type": "truefalse",
      "q": "イギリスの首都はパリである。",
      "answer": false,
      "explain": "イギリスの首都はロンドン。パリはフランスの首都。",
      "level": 1
    },
    {
      "tags": [
        "世界"
      ],
      "type": "truefalse",
      "q": "アフリカ大陸は、六大陸の中でいちばん大きい。",
      "answer": false,
      "explain": "いちばん大きいのはユーラシア大陸。",
      "level": 2
    },
    {
      "tags": [
        "世界"
      ],
      "type": "pairs",
      "q": "国と首都",
      "pairs": [
        [
          "日本",
          "東京"
        ],
        [
          "フランス",
          "パリ"
        ],
        [
          "イギリス",
          "ロンドン"
        ],
        [
          "イタリア",
          "ローマ"
        ],
        [
          "ドイツ",
          "ベルリン"
        ],
        [
          "韓国",
          "ソウル"
        ],
        [
          "エジプト",
          "カイロ"
        ],
        [
          "タイ",
          "バンコク"
        ]
      ]
    },
    {
      "tags": [
        "世界"
      ],
      "type": "pairs",
      "q": "国と首都（ちょっとむずかしい）",
      "pairs": [
        [
          "オーストラリア",
          "キャンベラ"
        ],
        [
          "カナダ",
          "オタワ"
        ],
        [
          "ブラジル",
          "ブラジリア"
        ],
        [
          "トルコ",
          "アンカラ"
        ],
        [
          "スイス",
          "ベルン"
        ],
        [
          "ニュージーランド",
          "ウェリントン"